[
  {
    "id": 0,
    "narrative": "은행: NH농협은행\n제공 금리(%) 1개월 이상 ~ 3개월 미만: 2.7\n3개월 이상 ~ 6개월 미만: 2.8\n6개월 이상 ~ 1년 미만: 3.0\n1년 이상 ~ 1년 6개월 미만: 4.0\n1년 6개월 이상 ~ 만기: 5.0\n은행 확인일: 25/02/12\n우대금리 조건: (적금 가입월~만기 전전월말) 은행에서 발급한 NH농협 개인신용·체크카드(채움) 월평균 10만원이상 이용실적 : 0.20%p (적금 가입월~만기 전전월말) 농협은행 주택청약종합저축(청년우대형 포함) 가입 및 5회이상 납입실적과 보유 시 : 0.30%p\n부가서비스: 군복무 기간 중‘NH농협손해보험 단체상해보험 내 군인(병) 영외 체류 기간 중 상해 특별약관’에 대한 무료가입 서비스 제공 - 대상 : 신규가입 초입금 20만원(보험금 청구 시 적금 매달 1만원이상 납입실적 有) - 보험보장금액 : 1천만원 - 보험개시 및 기간 : 적금 가입 다음날 00시부터 전역(소집해제)전일까지 - 보장기간 및 범위 : 군 복무 기간 중 영외 체류 기간동안 상해 발생 시(영외 체류는 휴가나 외박, 외출에 해당되며 군복무에 의한 영외체류는 제외)\n중도해지금리: 1개월미만 : 0.1% 3개월미만 : 0.15% 6개월미만 : 중도해지 기준금리*20% 9개월미만 : 중도해지 기준금리*30% 12개월미만 : 중도해지 기준금리*40% 18개월미만 : 중도해지 기준금리*45% 24개월미만 : 중도해지 기준금리*50% * (중도해지기준금리) 가입일 당시 고시된 자유로우대적금 기본금리\n만기후금리: 만기후 1년 이내 : 만기시점 계약기간별 기본금리의 1/2 만기후 1년 초과 : 보통예금 금리",
    "metadata": {
      "은행": "NH농협은행",
      "제공 금리(%) 1개월 이상 ~ 3개월 미만": "2.7",
      "3개월 이상 ~ 6개월 미만": "2.8",
      "6개월 이상 ~ 1년 미만": "3.0",
      "1년 이상 ~ 1년 6개월 미만": "4.0",
      "1년 6개월 이상 ~ 만기": "5.0",
      "은행 확인일": "25/02/12",
      "우대금리 조건": "(적금 가입월~만기 전전월말) 은행에서 발급한 NH농협 개인신용·체크카드(채움) 월평균 10만원이상 이용실적 : 0.20%p (적금 가입월~만기 전전월말) 농협은행 주택청약종합저축(청년우대형 포함) 가입 및 5회이상 납입실적과 보유 시 : 0.30%p",
      "부가서비스": "군복무 기간 중‘NH농협손해보험 단체상해보험 내 군인(병) 영외 체류 기간 중 상해 특별약관’에 대한 무료가입 서비스 제공 - 대상 : 신규가입 초입금 20만원(보험금 청구 시 적금 매달 1만원이상 납입실적 有) - 보험보장금액 : 1천만원 - 보험개시 및 기간 : 적금 가입 다음날 00시부터 전역(소집해제)전일까지 - 보장기간 및 범위 : 군 복무 기간 중 영외 체류 기간동안 상해 발생 시(영외 체류는 휴가나 외박, 외출에 해당되며 군복무에 의한 영외체류는 제외)",
      "중도해지금리": "1개월미만 : 0.1% 3개월미만 : 0.15% 6개월미만 : 중도해지 기준금리*20% 9개월미만 : 중도해지 기준금리*30% 12개월미만 : 중도해지 기준금리*40% 18개월미만 : 중도해지 기준금리*45% 24개월미만 : 중도해지 기준금리*50% * (중도해지기준금리) 가입일 당시 고시된 자유로우대적금 기본금리",
      "만기후금리": "만기후 1년 이내 : 만기시점 계약기간별 기본금리의 1/2 만기후 1년 초과 : 보통예금 금리"
    }
  },
  {
    "id": 1,
    "narrative": "은행: 신한은행\n제공 금리(%) 1개월 이상 ~ 3개월 미만: 3.5\n3개월 이상 ~ 6개월 미만: 3.5\n6개월 이상 ~ 1년 미만: 4.0\n1년 이상 ~ 1년 6개월 미만: 4.5\n1년 6개월 이상 ~ 만기: 5.0\n은행 확인일: 25/01/20\n우대금리 조건: 우대이자율: 최고 연 3.0% ※계약기간 6개월 미만 계좌에 대해서는 적용하지 않습니다. ① 주택청약 우대이자율(연 0.30%) ② 신한카드 우대이자율(연 0.20%) ③ 자동이체 우대이자율(연 0.20%) ④ 소득이체 우대이자율(연 0.50%) ⑤ 기초생활수급자 (연 3.0%)\n부가서비스: 이 적금 만기일(전역일)로부터 1년간 입출금계좌 수수료 면제 ① 전자금융수수료 면제: 인터넷뱅킹, 폰뱅킹, 모바일뱅킹의 다른은행 이체수수료 면제 ② 자동화기기 수수료 면제 - 신한은행 기기를 이용한 신한은행 계좌의 현금인출수수료 면제 - 신한은행 기기를 이용한 계좌의 다른은행 이체수수료 월 10회 면제 - 다른은행 기기를 이용한 신한은행 계좌의 현금인출수수료 월5회 면제\n중도해지금리: 1개월 미만: 연 0.10% 1개월 이상: 기본이자율 * (1-차감율) * 경과월수 / 계약월수 (단, 연 0.10% 미만으로 산출될 경우 연 0.10% 적용) ※ 경과월수별 차감율 (2020.6.22 현재) 1개월 이상 80% 3개월 이상 70% 6개월 이상 30% 9개월 이상 20% 11개월 이상 10%\n만기후금리: 만기후 1개월이내: 만기일 당시의 가입기간에 해당하는 일반정기적금 연 이자율의 1/2(단,최저금리 0.10%) 만기후 1개월초과 6개월이내: 만기일 당시의 가입기간에 해당하는 일반정기적금 연 이자율 1/4(단,최저금리 0.10%) 만기후 6개월 초과: 연 0.10% ※ 이자율이 변경될 경우 기간 구분하여 변경일부터 변경된 이자율 적용",
    "metadata": {
      "은행": "신한은행",
      "제공 금리(%) 1개월 이상 ~ 3개월 미만": "3.5",
      "3개월 이상 ~ 6개월 미만": "3.5",
      "6개월 이상 ~ 1년 미만": "4.0",
      "1년 이상 ~ 1년 6개월 미만": "4.5",
      "1년 6개월 이상 ~ 만기": "5.0",
      "은행 확인일": "25/01/20",
      "우대금리 조건": "우대이자율: 최고 연 3.0% ※계약기간 6개월 미만 계좌에 대해서는 적용하지 않습니다. ① 주택청약 우대이자율(연 0.30%) ② 신한카드 우대이자율(연 0.20%) ③ 자동이체 우대이자율(연 0.20%) ④ 소득이체 우대이자율(연 0.50%) ⑤ 기초생활수급자 (연 3.0%)",
      "부가서비스": "이 적금 만기일(전역일)로부터 1년간 입출금계좌 수수료 면제 ① 전자금융수수료 면제: 인터넷뱅킹, 폰뱅킹, 모바일뱅킹의 다른은행 이체수수료 면제 ② 자동화기기 수수료 면제 - 신한은행 기기를 이용한 신한은행 계좌의 현금인출수수료 면제 - 신한은행 기기를 이용한 계좌의 다른은행 이체수수료 월 10회 면제 - 다른은행 기기를 이용한 신한은행 계좌의 현금인출수수료 월5회 면제",
      "중도해지금리": "1개월 미만: 연 0.10% 1개월 이상: 기본이자율 * (1-차감율) * 경과월수 / 계약월수 (단, 연 0.10% 미만으로 산출될 경우 연 0.10% 적용) ※ 경과월수별 차감율 (2020.6.22 현재) 1개월 이상 80% 3개월 이상 70% 6개월 이상 30% 9개월 이상 20% 11개월 이상 10%",
      "만기후금리": "만기후 1개월이내: 만기일 당시의 가입기간에 해당하는 일반정기적금 연 이자율의 1/2(단,최저금리 0.10%) 만기후 1개월초과 6개월이내: 만기일 당시의 가입기간에 해당하는 일반정기적금 연 이자율 1/4(단,최저금리 0.10%) 만기후 6개월 초과: 연 0.10% ※ 이자율이 변경될 경우 기간 구분하여 변경일부터 변경된 이자율 적용"
    }
  },
  {
    "id": 2,
    "narrative": "은행: 우리은행\n제공 금리(%) 1개월 이상 ~ 3개월 미만: 3.7\n3개월 이상 ~ 6개월 미만: 3.7\n6개월 이상 ~ 1년 미만: 4.0\n1년 이상 ~ 1년 6개월 미만: 4.3\n1년 6개월 이상 ~ 만기: 5.0\n은행 확인일: 25/01/20\n우대금리 조건: 아래의 조건을 충족하는 경우 최대 연 1.0%p 우대금리 적용 □ 단, 계약기간 3개월 미만인 경우 최대 연 0.4%p 적용 (아래 1, 2 항목 미적용) (1) 우리은행 입출식 계좌에서 매월 자동이체를 통해 적립 - 연 0.4%p (2) 우리카드 결제계좌를 우리은행 입출식 계좌로 지정한 후, 매월 결제실적 보유 - 연 0.2%p (3) 적금 신규 시점에 우리은행에서 가입한 \"주택청약종합저축\" 보유 - 연 0.2%p (4) 우리은행 마케팅 동의항목 중 휴대폰, SMS 중 하나 이상을 동의한 후 만기 해지시점까지 유지 - 연 0.2%p\n부가서비스: 무료상해보험(DB손해보험 제공) 가입 서비스 - 보장기간 : 적금 신규가입 다음 월 15일부터 21개월 동안 제공 - 담보명 및 담보가입금액 : 현역군인상해사망후유장해(300만원), 상해흉터복원수술비(14만원), 화상진단비(20만원), 골절진단비(10만원), 의사상자상해위험(3억원) - 담보내용 : 상세 내용 상품설명서 참조 금융수수료 면제 서비스 - 우리은행 자동화기기 출금 수수료 무제한 면제 - 다른은행 자동화기기 출금수수료 월 5회 면제 적금 가입 시점에 조건 충족시 위 부대서비스 가능 : 상세 내용 상품명서 참조\n중도해지금리: 신규일 당시 고시한 일반정기적금 중도해지이율 적용 (1) 신규시점 일반정기적금 약정이율 x 50% x (보유일수/계약일수) (2) 단, 최저이율은 아래와 같음 - 1개월 미만 : 연 0.1%p - 1개월 이상 ~ 3개월 미만 : 연 0.3%p - 3개월 이상 : 연 0.5%p\n만기후금리: 만기일 당시 고시한 일반정기적금 만기 후 이율 적용 - 1개월 미만 : 만기시점 약정이율 x 50% - 1개월 이상 ~ 3개월 미만 : 만기시점 약정이율 x 30% - 3개월 이상 : 만기시점 약정이율 x 20%",
    "metadata": {
      "은행": "우리은행",
      "제공 금리(%) 1개월 이상 ~ 3개월 미만": "3.7",
      "3개월 이상 ~ 6개월 미만": "3.7",
      "6개월 이상 ~ 1년 미만": "4.0",
      "1년 이상 ~ 1년 6개월 미만": "4.3",
      "1년 6개월 이상 ~ 만기": "5.0",
      "은행 확인일": "25/01/20",
      "우대금리 조건": "아래의 조건을 충족하는 경우 최대 연 1.0%p 우대금리 적용 □ 단, 계약기간 3개월 미만인 경우 최대 연 0.4%p 적용 (아래 1, 2 항목 미적용) (1) 우리은행 입출식 계좌에서 매월 자동이체를 통해 적립 - 연 0.4%p (2) 우리카드 결제계좌를 우리은행 입출식 계좌로 지정한 후, 매월 결제실적 보유 - 연 0.2%p (3) 적금 신규 시점에 우리은행에서 가입한 \"주택청약종합저축\" 보유 - 연 0.2%p (4) 우리은행 마케팅 동의항목 중 휴대폰, SMS 중 하나 이상을 동의한 후 만기 해지시점까지 유지 - 연 0.2%p",
      "부가서비스": "무료상해보험(DB손해보험 제공) 가입 서비스 - 보장기간 : 적금 신규가입 다음 월 15일부터 21개월 동안 제공 - 담보명 및 담보가입금액 : 현역군인상해사망후유장해(300만원), 상해흉터복원수술비(14만원), 화상진단비(20만원), 골절진단비(10만원), 의사상자상해위험(3억원) - 담보내용 : 상세 내용 상품설명서 참조 금융수수료 면제 서비스 - 우리은행 자동화기기 출금 수수료 무제한 면제 - 다른은행 자동화기기 출금수수료 월 5회 면제 적금 가입 시점에 조건 충족시 위 부대서비스 가능 : 상세 내용 상품명서 참조",
      "중도해지금리": "신규일 당시 고시한 일반정기적금 중도해지이율 적용 (1) 신규시점 일반정기적금 약정이율 x 50% x (보유일수/계약일수) (2) 단, 최저이율은 아래와 같음 - 1개월 미만 : 연 0.1%p - 1개월 이상 ~ 3개월 미만 : 연 0.3%p - 3개월 이상 : 연 0.5%p",
      "만기후금리": "만기일 당시 고시한 일반정기적금 만기 후 이율 적용 - 1개월 미만 : 만기시점 약정이율 x 50% - 1개월 이상 ~ 3개월 미만 : 만기시점 약정이율 x 30% - 3개월 이상 : 만기시점 약정이율 x 20%"
    }
  },
  {
    "id": 3,
    "narrative": "은행: 하나은행\n제공 금리(%) 1개월 이상 ~ 3개월 미만: 3.5\n3개월 이상 ~ 6개월 미만: 3.5\n6개월 이상 ~ 1년 미만: 3.5\n1년 이상 ~ 1년 6개월 미만: 4.0\n1년 6개월 이상 ~ 만기: 5.0\n은행 확인일: 25/01/20\n우대금리 조건: [우대금리 조건] (우대금리 : 최고 연 3.0%) - 당행 주택청약종합저축 보유시 연 0.5% 우대 - 당행 입출금통장을 통해 3회이상 군급여 입금실적이 있거나,하나카드사의 카드(신용/체크)결제 실적이 3회 이상 있을 경우 연 0.7%우대 (군급여이체 및 카드결제 실적은 월1회만 인정하며, 군급여이체실적은 국군재정관리단을 통한 이체에 한정) -이 예금 가입후 만기 전일까지 하나은행 영업점을 방문하여 `기초생활수급자`임을 증빙하는 서류를 제출하는 경우 연 1.8% 우대\n부가서비스: 당행 입출금 통장을 통한 군급여이체시 각종 금융수수료 면제\n중도해지금리: 1개월미만 : 연 0.1% 1개월이상 3개월미만 : 연 0.15% 3개월이상 6개월미만 : 연 0.2% 6개월이상 : 가입 당시 기본금리*차등률(주1)*경과율(주2) (단,해당금리가 연0.2%미만시 연0.2%적용) (주1) 차등률:6개월 ~ 9개월 미만 경과시 : 60%적용 9개월이상 ~ 11개월 미만 경과시: 70%적용 11개월이상 경과시 : 90% 적용 (주2) 경과율:경과일수/계약일수 (단,경과일수는 계약일수를 초과할 수 없음)\n만기후금리: 1개월 이내 : 지급 당시 해당기간별 일반정기적금 기본금리의 1/2 1개월 초과 : 지급 당시 해당기간별 일반정기적금 기본금리의 1/4 ※ 단, 계약기간이 6개월 미만인 경우, 지급당시 정기적금 6개월제 기본금리 기준 적용",
    "metadata": {
      "은행": "하나은행",
      "제공 금리(%) 1개월 이상 ~ 3개월 미만": "3.5",
      "3개월 이상 ~ 6개월 미만": "3.5",
      "6개월 이상 ~ 1년 미만": "3.5",
      "1년 이상 ~ 1년 6개월 미만": "4.0",
      "1년 6개월 이상 ~ 만기": "5.0",
      "은행 확인일": "25/01/20",
      "우대금리 조건": "[우대금리 조건] (우대금리 : 최고 연 3.0%) - 당행 주택청약종합저축 보유시 연 0.5% 우대 - 당행 입출금통장을 통해 3회이상 군급여 입금실적이 있거나,하나카드사의 카드(신용/체크)결제 실적이 3회 이상 있을 경우 연 0.7%우대 (군급여이체 및 카드결제 실적은 월1회만 인정하며, 군급여이체실적은 국군재정관리단을 통한 이체에 한정) -이 예금 가입후 만기 전일까지 하나은행 영업점을 방문하여 `기초생활수급자`임을 증빙하는 서류를 제출하는 경우 연 1.8% 우대",
      "부가서비스": "당행 입출금 통장을 통한 군급여이체시 각종 금융수수료 면제",
      "중도해지금리": "1개월미만 : 연 0.1% 1개월이상 3개월미만 : 연 0.15% 3개월이상 6개월미만 : 연 0.2% 6개월이상 : 가입 당시 기본금리*차등률(주1)*경과율(주2) (단,해당금리가 연0.2%미만시 연0.2%적용) (주1) 차등률:6개월 ~ 9개월 미만 경과시 : 60%적용 9개월이상 ~ 11개월 미만 경과시: 70%적용 11개월이상 경과시 : 90% 적용 (주2) 경과율:경과일수/계약일수 (단,경과일수는 계약일수를 초과할 수 없음)",
      "만기후금리": "1개월 이내 : 지급 당시 해당기간별 일반정기적금 기본금리의 1/2 1개월 초과 : 지급 당시 해당기간별 일반정기적금 기본금리의 1/4 ※ 단, 계약기간이 6개월 미만인 경우, 지급당시 정기적금 6개월제 기본금리 기준 적용"
    }
  },
  {
    "id": 4,
    "narrative": "은행: IBK기업은행\n제공 금리(%) 1개월 이상 ~ 3개월 미만: 4.0\n3개월 이상 ~ 6개월 미만: 4.0\n6개월 이상 ~ 1년 미만: 4.0\n1년 이상 ~ 1년 6개월 미만: 4.5\n1년 6개월 이상 ~ 만기: 5.0\n은행 확인일: 25/01/20\n우대금리 조건: - 당행 입출금식 계좌로 급여이체(10만원 이상) 6회 이상 실적이 있는 경우 : 연 0.5%p - 당행 주택청약종합저축(청년우대형 포함)을 신규한 경우 : 연 0.3%p - 당행 나라사랑카드를 1회 이상 사용한 경우 : 연 0.3%p - 기초생활수급자 : 연 3.0%p\n부가서비스: 1%이자지원금 및 3:1매칭지원금 정부지원\n중도해지금리: 신규가입일 당시 영업점 및 인터넷 홈페이지에 고시한 정기적금의 중도해지이율 적용 -경과비율 10% 미만 : 가입일 현재 계약기간별 고시금리*5% -경과비율 10%이상 20%미만 : 가입일 현재 계약기간별 고시금리*10% -경과비율 20%이상 40%미만 : 가입일 현재 계약기간별 고시금리*20% -경과비율 40%이상 60%미만 : 가입일 현재 계약기간별 고시금리*40% -경과비율 60%이상 80%미만 : 가입일 현재 계약기간별 고시금리*60% -납입기간 경과비율 80%이상 : 가입일 현재 계약기간별 고시금리*80%\n만기후금리: 만기일 당시 영업점 및 인터넷 홈페이지에 고시한 정기적금의 만기후이자율 적용 -만기 후 1개월 이내 : 만기일 당시 계약기간별 고시금리*50% -만기 후 1개월 초과 6개월 이내 : 만기일 당시 계약기간별 고시금리*30% -만기 후 6개월 초과 : 만기일 당시 계약기간별 고시금리*20%",
    "metadata": {
      "은행": "IBK기업은행",
      "제공 금리(%) 1개월 이상 ~ 3개월 미만": "4.0",
      "3개월 이상 ~ 6개월 미만": "4.0",
      "6개월 이상 ~ 1년 미만": "4.0",
      "1년 이상 ~ 1년 6개월 미만": "4.5",
      "1년 6개월 이상 ~ 만기": "5.0",
      "은행 확인일": "25/01/20",
      "우대금리 조건": "- 당행 입출금식 계좌로 급여이체(10만원 이상) 6회 이상 실적이 있는 경우 : 연 0.5%p - 당행 주택청약종합저축(청년우대형 포함)을 신규한 경우 : 연 0.3%p - 당행 나라사랑카드를 1회 이상 사용한 경우 : 연 0.3%p - 기초생활수급자 : 연 3.0%p",
      "부가서비스": "1%이자지원금 및 3:1매칭지원금 정부지원",
      "중도해지금리": "신규가입일 당시 영업점 및 인터넷 홈페이지에 고시한 정기적금의 중도해지이율 적용 -경과비율 10% 미만 : 가입일 현재 계약기간별 고시금리*5% -경과비율 10%이상 20%미만 : 가입일 현재 계약기간별 고시금리*10% -경과비율 20%이상 40%미만 : 가입일 현재 계약기간별 고시금리*20% -경과비율 40%이상 60%미만 : 가입일 현재 계약기간별 고시금리*40% -경과비율 60%이상 80%미만 : 가입일 현재 계약기간별 고시금리*60% -납입기간 경과비율 80%이상 : 가입일 현재 계약기간별 고시금리*80%",
      "만기후금리": "만기일 당시 영업점 및 인터넷 홈페이지에 고시한 정기적금의 만기후이자율 적용 -만기 후 1개월 이내 : 만기일 당시 계약기간별 고시금리*50% -만기 후 1개월 초과 6개월 이내 : 만기일 당시 계약기간별 고시금리*30% -만기 후 6개월 초과 : 만기일 당시 계약기간별 고시금리*20%"
    }
  },
  {
    "id": 5,
    "narrative": "은행: KB국민은행\n제공 금리(%) 1개월 이상 ~ 3개월 미만: 3.5\n3개월 이상 ~ 6개월 미만: 3.5\n6개월 이상 ~ 1년 미만: 3.5\n1년 이상 ~ 1년 6개월 미만: 4.0\n1년 6개월 이상 ~ 만기: 5.0\n은행 확인일: 25/01/20\n우대금리 조건: 급여이체실적: 적금 신규월 초일부터 만기일 전전월 말일까지 계약기간(월환산)의 2/3 동안 급여이체 실적 매월 10만원 이상시 연 0.5%p 주택청약종합저축계좌보유: 적금 만기일의 전전월 말일 기준으로,KB국민은행 주택청약종합저축(청년우대형주택청약종합저축 포함)보유시 연0.2%p 나라사랑카드: 적금 신규월 초일부터 만기일 기준 전전월 말일까지 KB국민나라사랑카드 이용실적 1회이상 발생하고, 보유시 연0.5%p 기초생활수급자: 적금 만기일의 전전월 말일까지 증빙서류 영업점 제출시 연3.0%p 단 최고는 연3.0%p임\n부가서비스: 당행 입출금 통장으로 급여이체시 당·타행 이체 및 출금수수료 면제 ※ 국군재정관리단 급여이체 등\n중도해지금리: 예치기간1개월미만:0.1 예치기간1개월이상~3개월미만:기본이율x50%x경과월수/계약월수(단,최저금리는0.1) 예치기간3개월이상~6개월미만:기본이율x50%x경과월수/계약월수(단,최저금리는0.1) 예치기간6개월이상~8개월미만:기본이율x60%x경과월수/계약월수(단,최저금리는0.2) 예치기간8개월이상~10개월미만:기본이율x70%x경과월수/계약월수(단,최저금리는0.2) 예치기간10개월이상~11개월미만:기본이율x80%x경과월수/계약월수(단,최저금리는0.2) 예치기간11개월이상:기본이율x90%x경과월수/계약월수(단,최저금리는0.2)\n만기후금리: 경과기간 만기후 1개월이내 : 기본이율 x 50% 경과기간 만기후 1개월 초과 ~ 3개월 이내 : 기본이율 x 30% 경과기간 만기후 3개월 초과 : 0.1",
    "metadata": {
      "은행": "KB국민은행",
      "제공 금리(%) 1개월 이상 ~ 3개월 미만": "3.5",
      "3개월 이상 ~ 6개월 미만": "3.5",
      "6개월 이상 ~ 1년 미만": "3.5",
      "1년 이상 ~ 1년 6개월 미만": "4.0",
      "1년 6개월 이상 ~ 만기": "5.0",
      "은행 확인일": "25/01/20",
      "우대금리 조건": "급여이체실적: 적금 신규월 초일부터 만기일 전전월 말일까지 계약기간(월환산)의 2/3 동안 급여이체 실적 매월 10만원 이상시 연 0.5%p 주택청약종합저축계좌보유: 적금 만기일의 전전월 말일 기준으로,KB국민은행 주택청약종합저축(청년우대형주택청약종합저축 포함)보유시 연0.2%p 나라사랑카드: 적금 신규월 초일부터 만기일 기준 전전월 말일까지 KB국민나라사랑카드 이용실적 1회이상 발생하고, 보유시 연0.5%p 기초생활수급자: 적금 만기일의 전전월 말일까지 증빙서류 영업점 제출시 연3.0%p 단 최고는 연3.0%p임",
      "부가서비스": "당행 입출금 통장으로 급여이체시 당·타행 이체 및 출금수수료 면제 ※ 국군재정관리단 급여이체 등",
      "중도해지금리": "예치기간1개월미만:0.1 예치기간1개월이상~3개월미만:기본이율x50%x경과월수/계약월수(단,최저금리는0.1) 예치기간3개월이상~6개월미만:기본이율x50%x경과월수/계약월수(단,최저금리는0.1) 예치기간6개월이상~8개월미만:기본이율x60%x경과월수/계약월수(단,최저금리는0.2) 예치기간8개월이상~10개월미만:기본이율x70%x경과월수/계약월수(단,최저금리는0.2) 예치기간10개월이상~11개월미만:기본이율x80%x경과월수/계약월수(단,최저금리는0.2) 예치기간11개월이상:기본이율x90%x경과월수/계약월수(단,최저금리는0.2)",
      "만기후금리": "경과기간 만기후 1개월이내 : 기본이율 x 50% 경과기간 만기후 1개월 초과 ~ 3개월 이내 : 기본이율 x 30% 경과기간 만기후 3개월 초과 : 0.1"
    }
  },
  {
    "id": 6,
    "narrative": "은행: Sh수협은행\n제공 금리(%) 1개월 이상 ~ 3개월 미만: 3.5\n3개월 이상 ~ 6개월 미만: 3.5\n6개월 이상 ~ 1년 미만: 4.0\n1년 이상 ~ 1년 6개월 미만: 4.5\n1년 6개월 이상 ~ 만기: 5.0\n은행 확인일: 25/01/20\n우대금리 조건: 우대금리 없음\n부가서비스: 이 적금 가입기간 동안 당행 보유 입출금통장을 통해 거래시 1. 전자금융 당ㆍ타행 이체수수료 면제(자동이체 및 상담원을 통한 이체 제외) 2. 당ㆍ타행 자동화기기 현금인출수수료 면제(제휴ATM기 제외)\n중도해지금리: 1개월미만:0.1% 1개월이상~3개월미만:0.1% 3개월이상~6개월미만:(기본금리x3/약정기간)x50% 6개월이상~10개월미만:(기본금리x경과월수/약정기간)x60% 10개월이상~11개월미만:(기본금리x경과월수/약정기간)x80% 11개월이상:(기본금리x경과월수/약정기간)x90% (3개월이상 최저금리:0.1%) * 세전 연이자율 기준 * 기본금리 : 신규가입일 당시 고시된 계약기간별 금리(우대금리 제외) * 약정기간 : 최초가입시 약정한 계약기간 * 가입일 당시 은행이 고시한 중도해지금리를 적용\n만기후금리: 만기후 12개월이하:만기당시 계약기간에 해당하는 상호부금 기본금리의 1/2 만기후 12개월초과:만기당시 보통예금 기본금리 *만기일 당시 은행이 고시한 만기 후 금리를 적용",
    "metadata": {
      "은행": "Sh수협은행",
      "제공 금리(%) 1개월 이상 ~ 3개월 미만": "3.5",
      "3개월 이상 ~ 6개월 미만": "3.5",
      "6개월 이상 ~ 1년 미만": "4.0",
      "1년 이상 ~ 1년 6개월 미만": "4.5",
      "1년 6개월 이상 ~ 만기": "5.0",
      "은행 확인일": "25/01/20",
      "우대금리 조건": "우대금리 없음",
      "부가서비스": "이 적금 가입기간 동안 당행 보유 입출금통장을 통해 거래시 1. 전자금융 당ㆍ타행 이체수수료 면제(자동이체 및 상담원을 통한 이체 제외) 2. 당ㆍ타행 자동화기기 현금인출수수료 면제(제휴ATM기 제외)",
      "중도해지금리": "1개월미만:0.1% 1개월이상~3개월미만:0.1% 3개월이상~6개월미만:(기본금리x3/약정기간)x50% 6개월이상~10개월미만:(기본금리x경과월수/약정기간)x60% 10개월이상~11개월미만:(기본금리x경과월수/약정기간)x80% 11개월이상:(기본금리x경과월수/약정기간)x90% (3개월이상 최저금리:0.1%) * 세전 연이자율 기준 * 기본금리 : 신규가입일 당시 고시된 계약기간별 금리(우대금리 제외) * 약정기간 : 최초가입시 약정한 계약기간 * 가입일 당시 은행이 고시한 중도해지금리를 적용",
      "만기후금리": "만기후 12개월이하:만기당시 계약기간에 해당하는 상호부금 기본금리의 1/2 만기후 12개월초과:만기당시 보통예금 기본금리 *만기일 당시 은행이 고시한 만기 후 금리를 적용"
    }
  },
  {
    "id": 7,
    "narrative": "은행: iM뱅크(구 대구은행)\n제공 금리(%) 1개월 이상 ~ 3개월 미만: 3.0\n3개월 이상 ~ 6개월 미만: 3.0\n6개월 이상 ~ 1년 미만: 4.0\n1년 이상 ~ 1년 6개월 미만: 4.5\n1년 6개월 이상 ~ 만기: 5.0\n은행 확인일: 25/01/20\n우대금리 조건: 우대이자율(최고 연0.50%p) ·이자율 결정일: 가입일 -상품 가입 전 당행에서 가입한 주택청약상품 보유 고객 연0.20%p ·이자율 결정일: 만기일 -다음의 두 가지 요건을 모두 충족한 고객 연0.30%p ① 만기일에 당행 체크카드 보유 ② 가입일로부터 만기일 전일까지 당행 입출금이자유로운예금을 결제계좌로한 당행 체크카드 결제 실적 보유 단, 승인 취소 건은 결제실적에서 제외 ※모든 우대이자율은 2024년 6월 3일 이후 가입한 고객에 한하여 적용하며, 기존 가입고객은 소급 적용이 불가합니다.\n부가서비스: 이 적금의 만기 해지 후 1년 이내, 당행 영업점을 통한 외화 환전·송금 거래에 한함. ① 외국통화 매매 시 : USD·JPY·EUR 50% 우대, CNY30% 우대 ② 외화송금수수료(해외로 보낼 때) : 50% 우대 ※다른 외환우대 기준에 따른 우대내용과 중복될 경우, 그 중 유리한 1가지 우대기준에 따른 우대내용 적용\n중도해지금리: 입금일로부터 20% 미만 경과된 월부금 : 기본이자율 X 10% 입금일로부터 20%~40% 미만 경과된 월부금 : 기본이자율 X 20% 입금일로부터 40%~60% 미만 경과된 월부금 : 기본이자율 X 40% 입금일로부터 60%~80% 미만 경과된 월부금 : 기본이자율 X 60% 입금일로부터 80%~100% 미만 경과된 월부금 : 기본이자율 X 80%\n만기후금리: 만기 후 1개월 미만 경과 : 약정이자율 X 50% 만기 후 3개월 미만 경과 : 약정이자율 X 25% 만기 후 3개월 이상 경과 : 약정이자율 X 10%",
    "metadata": {
      "은행": "iM뱅크(구 대구은행)",
      "제공 금리(%) 1개월 이상 ~ 3개월 미만": "3.0",
      "3개월 이상 ~ 6개월 미만": "3.0",
      "6개월 이상 ~ 1년 미만": "4.0",
      "1년 이상 ~ 1년 6개월 미만": "4.5",
      "1년 6개월 이상 ~ 만기": "5.0",
      "은행 확인일": "25/01/20",
      "우대금리 조건": "우대이자율(최고 연0.50%p) ·이자율 결정일: 가입일 -상품 가입 전 당행에서 가입한 주택청약상품 보유 고객 연0.20%p ·이자율 결정일: 만기일 -다음의 두 가지 요건을 모두 충족한 고객 연0.30%p ① 만기일에 당행 체크카드 보유 ② 가입일로부터 만기일 전일까지 당행 입출금이자유로운예금을 결제계좌로한 당행 체크카드 결제 실적 보유 단, 승인 취소 건은 결제실적에서 제외 ※모든 우대이자율은 2024년 6월 3일 이후 가입한 고객에 한하여 적용하며, 기존 가입고객은 소급 적용이 불가합니다.",
      "부가서비스": "이 적금의 만기 해지 후 1년 이내, 당행 영업점을 통한 외화 환전·송금 거래에 한함. ① 외국통화 매매 시 : USD·JPY·EUR 50% 우대, CNY30% 우대 ② 외화송금수수료(해외로 보낼 때) : 50% 우대 ※다른 외환우대 기준에 따른 우대내용과 중복될 경우, 그 중 유리한 1가지 우대기준에 따른 우대내용 적용",
      "중도해지금리": "입금일로부터 20% 미만 경과된 월부금 : 기본이자율 X 10% 입금일로부터 20%~40% 미만 경과된 월부금 : 기본이자율 X 20% 입금일로부터 40%~60% 미만 경과된 월부금 : 기본이자율 X 40% 입금일로부터 60%~80% 미만 경과된 월부금 : 기본이자율 X 60% 입금일로부터 80%~100% 미만 경과된 월부금 : 기본이자율 X 80%",
      "만기후금리": "만기 후 1개월 미만 경과 : 약정이자율 X 50% 만기 후 3개월 미만 경과 : 약정이자율 X 25% 만기 후 3개월 이상 경과 : 약정이자율 X 10%"
    }
  },
  {
    "id": 8,
    "narrative": "은행: BNK부산은행\n제공 금리(%) 1개월 이상 ~ 3개월 미만: 3.0\n3개월 이상 ~ 6개월 미만: 3.0\n6개월 이상 ~ 1년 미만: 3.5\n1년 이상 ~ 1년 6개월 미만: 4.0\n1년 6개월 이상 ~ 만기: 5.0\n은행 확인일: 25/01/20\n우대금리 조건: 만기 시 본인명의 주택청약종합저축 보유 : 0.10%\n부가서비스: 해당사항 없음\n중도해지금리: 가입일 당시 상품별 기본이율 x 적용율 x (경과일수/계약일수) * 적용율 -6개월미만 40% -6개월이상~9개월미만 70% -9개월이상~11개월미만 80% -11개월이상 90% *단, 최저이율 0.01% 적용\n만기후금리: 만기후 1년이내 : 지급일 당시 가입기간별 기본이율 x 1/2 만기후 1년초과 : 지급일 당시 가입기간별 기본이율 x 1/5",
    "metadata": {
      "은행": "BNK부산은행",
      "제공 금리(%) 1개월 이상 ~ 3개월 미만": "3.0",
      "3개월 이상 ~ 6개월 미만": "3.0",
      "6개월 이상 ~ 1년 미만": "3.5",
      "1년 이상 ~ 1년 6개월 미만": "4.0",
      "1년 6개월 이상 ~ 만기": "5.0",
      "은행 확인일": "25/01/20",
      "우대금리 조건": "만기 시 본인명의 주택청약종합저축 보유 : 0.10%",
      "부가서비스": "해당사항 없음",
      "중도해지금리": "가입일 당시 상품별 기본이율 x 적용율 x (경과일수/계약일수) * 적용율 -6개월미만 40% -6개월이상~9개월미만 70% -9개월이상~11개월미만 80% -11개월이상 90% *단, 최저이율 0.01% 적용",
      "만기후금리": "만기후 1년이내 : 지급일 당시 가입기간별 기본이율 x 1/2 만기후 1년초과 : 지급일 당시 가입기간별 기본이율 x 1/5"
    }
  },
  {
    "id": 9,
    "narrative": "은행: 광주은행\n제공 금리(%) 1개월 이상 ~ 3개월 미만: 2.9\n3개월 이상 ~ 6개월 미만: 3.2\n6개월 이상 ~ 1년 미만: 3.7\n1년 이상 ~ 1년 6개월 미만: 4.2\n1년 6개월 이상 ~ 만기: 5.0\n은행 확인일: 25/01/20\n우대금리 조건: 최대 0.5%p 우대금리 적용 (1) (적금 가입일~만기 전전월말 말일)요구불예금 최근 3개월 평잔이 30만원 이상인 경우 : 0.10%p (2) (적금 가입일~만기 전전월말 말일)신용카드(또는 체크카드) 사용실적 100만원 이상인 경우 : 0.10%p (3)요구불예금에서 이 예금으로 적립액 자동이체 설정하여 5회 이상 입금된 경우 : 0.10%p (4)(적금 가입일~만기 전일)요구불계좌에서 전자금융을 이용한 당,타행 출금이체 거래실적 5회 이상인 경우 : 0.20%p\n부가서비스: 해당사항 없음\n중도해지금리: 예치기간 1개월 미만 : 연 0.1%p 예치기간 1개월 이상 : 공시금리 x 보유기간별 적용률(10~80%) - 계약기간의 2/10 이내 : 공시금리 x 10% - 계약기간의 2/10 초과 ~ 4/10 이내 : 공시금리 x 20% - 계약기간의 4/10 초과 ~ 6/10 이내 : 공시금리 x 40% - 계약기간의 6/10 초과 ~ 8/10 이내 : 공시금리 x 60% - 계약기간의 8/10 초과 : 공시금리 X 80%\n만기후금리: 만기후 1개월 이내 - 만기일 당시 최초가입별 고시금리의 1/2 만기후 1개월 초과 : 0.10%",
    "metadata": {
      "은행": "광주은행",
      "제공 금리(%) 1개월 이상 ~ 3개월 미만": "2.9",
      "3개월 이상 ~ 6개월 미만": "3.2",
      "6개월 이상 ~ 1년 미만": "3.7",
      "1년 이상 ~ 1년 6개월 미만": "4.2",
      "1년 6개월 이상 ~ 만기": "5.0",
      "은행 확인일": "25/01/20",
      "우대금리 조건": "최대 0.5%p 우대금리 적용 (1) (적금 가입일~만기 전전월말 말일)요구불예금 최근 3개월 평잔이 30만원 이상인 경우 : 0.10%p (2) (적금 가입일~만기 전전월말 말일)신용카드(또는 체크카드) 사용실적 100만원 이상인 경우 : 0.10%p (3)요구불예금에서 이 예금으로 적립액 자동이체 설정하여 5회 이상 입금된 경우 : 0.10%p (4)(적금 가입일~만기 전일)요구불계좌에서 전자금융을 이용한 당,타행 출금이체 거래실적 5회 이상인 경우 : 0.20%p",
      "부가서비스": "해당사항 없음",
      "중도해지금리": "예치기간 1개월 미만 : 연 0.1%p 예치기간 1개월 이상 : 공시금리 x 보유기간별 적용률(10~80%) - 계약기간의 2/10 이내 : 공시금리 x 10% - 계약기간의 2/10 초과 ~ 4/10 이내 : 공시금리 x 20% - 계약기간의 4/10 초과 ~ 6/10 이내 : 공시금리 x 40% - 계약기간의 6/10 초과 ~ 8/10 이내 : 공시금리 x 60% - 계약기간의 8/10 초과 : 공시금리 X 80%",
      "만기후금리": "만기후 1개월 이내 - 만기일 당시 최초가입별 고시금리의 1/2 만기후 1개월 초과 : 0.10%"
    }
  },
  {
    "id": 10,
    "narrative": "은행: 제주은행\n제공 금리(%) 1개월 이상 ~ 3개월 미만: 3.5\n3개월 이상 ~ 6개월 미만: 3.5\n6개월 이상 ~ 1년 미만: 4.0\n1년 이상 ~ 1년 6개월 미만: 4.5\n1년 6개월 이상 ~ 만기: 5.0\n은행 확인일: 25/01/20\n우대금리 조건: 해당사항없음\n부가서비스: 해당사항없음\n중도해지금리: 신규일 당시 영업점 및 홈페이지에 고시된 제주은행 장병 내일준비적금 기본이자율 적용 1. 1개월 미만 : 연 0.1% 2 아래의 기간에서는 최저금리 0.1% 적용 -1개월 이상 3개월미만: [해당 적금] 기본이자율*20%*경과월수/계약월수 -3개월 이상 6개월미만: [해당 적금] 기본이자율*30%*경과월수/계약월수 -6개월 이상 9개월미만: [해당 적금] 기본이자율*60%*경과월수/계약월수 -9개월 이상 11개월미만:[해당 적금] 기본이자율*70%*경과월수/계약월수 -11개월 이상: [해당 적금] 기본이자율*80%*경과월수/계약월수\n만기후금리: 만기일 당시 영업점 및 홈페이지에 고시된 (일반)정기적금기본이자율 - 만기 후 1개월 이내 경과분 : 기본이자율의 50% (단, 최저금리 0.1%) - 만기 후 1개월 초과 3개월 이내 : 기본이자율의 25% (단, 최저금리 0.1%) - 만기 후 3개월 초과 경과분 : 0.1%",
    "metadata": {
      "은행": "제주은행",
      "제공 금리(%) 1개월 이상 ~ 3개월 미만": "3.5",
      "3개월 이상 ~ 6개월 미만": "3.5",
      "6개월 이상 ~ 1년 미만": "4.0",
      "1년 이상 ~ 1년 6개월 미만": "4.5",
      "1년 6개월 이상 ~ 만기": "5.0",
      "은행 확인일": "25/01/20",
      "우대금리 조건": "해당사항없음",
      "부가서비스": "해당사항없음",
      "중도해지금리": "신규일 당시 영업점 및 홈페이지에 고시된 제주은행 장병 내일준비적금 기본이자율 적용 1. 1개월 미만 : 연 0.1% 2 아래의 기간에서는 최저금리 0.1% 적용 -1개월 이상 3개월미만: [해당 적금] 기본이자율*20%*경과월수/계약월수 -3개월 이상 6개월미만: [해당 적금] 기본이자율*30%*경과월수/계약월수 -6개월 이상 9개월미만: [해당 적금] 기본이자율*60%*경과월수/계약월수 -9개월 이상 11개월미만:[해당 적금] 기본이자율*70%*경과월수/계약월수 -11개월 이상: [해당 적금] 기본이자율*80%*경과월수/계약월수",
      "만기후금리": "만기일 당시 영업점 및 홈페이지에 고시된 (일반)정기적금기본이자율 - 만기 후 1개월 이내 경과분 : 기본이자율의 50% (단, 최저금리 0.1%) - 만기 후 1개월 초과 3개월 이내 : 기본이자율의 25% (단, 최저금리 0.1%) - 만기 후 3개월 초과 경과분 : 0.1%"
    }
  },
  {
    "id": 11,
    "narrative": "은행: 전북은행\n제공 금리(%) 1개월 이상 ~ 3개월 미만: 3.0\n3개월 이상 ~ 6개월 미만: 3.0\n6개월 이상 ~ 1년 미만: 3.6\n1년 이상 ~ 1년 6개월 미만: 4.1\n1년 6개월 이상 ~ 만기: 5.0\n은행 확인일: 25/01/20\n우대금리 조건: 계약기간별 금리조건 6개월 이상 ~ 12개월 미만 : 연 3.60% 12개월 이상 ~ 15개월 미만 : 연 4.10% 15개월 이상 ~ 24개월 미만 : 연 5.00%\n부가서비스: 해당사항 없음\n중도해지금리: 1개월미만 경과분 연0.1% 약정기간의 20%이내 경과분 : 신규일 당시 계약기간별 정기적금(자유적립식) 실행이율 1/10 약정기간의 40%이내 경과분 : 신규일 당시 계약기간별 정기적금(자유적립식) 실행이율 2/10 약정기간의 60%이내 경과분 : 신규일 당시 계약기간별 정기적금(자유적립식) 실행이율 4/10 약정기간의 80%이내 경과분 : 신규일 당시 계약기간별 정기적금(자유적립식) 실행이율 6/10 약정기간의 100%미만 경과분 : 신규일 당시 계약기간별 정기적금(자유적립식) 실행이율 8/10\n만기후금리: 만기후 1개월 이내 경과분 : 만기일 현재 계약기간별 정기적금(자유적립식) 실행이율의 1/2 만기후 1개월 초과 경과분 : 연 0.10%",
    "metadata": {
      "은행": "전북은행",
      "제공 금리(%) 1개월 이상 ~ 3개월 미만": "3.0",
      "3개월 이상 ~ 6개월 미만": "3.0",
      "6개월 이상 ~ 1년 미만": "3.6",
      "1년 이상 ~ 1년 6개월 미만": "4.1",
      "1년 6개월 이상 ~ 만기": "5.0",
      "은행 확인일": "25/01/20",
      "우대금리 조건": "계약기간별 금리조건 6개월 이상 ~ 12개월 미만 : 연 3.60% 12개월 이상 ~ 15개월 미만 : 연 4.10% 15개월 이상 ~ 24개월 미만 : 연 5.00%",
      "부가서비스": "해당사항 없음",
      "중도해지금리": "1개월미만 경과분 연0.1% 약정기간의 20%이내 경과분 : 신규일 당시 계약기간별 정기적금(자유적립식) 실행이율 1/10 약정기간의 40%이내 경과분 : 신규일 당시 계약기간별 정기적금(자유적립식) 실행이율 2/10 약정기간의 60%이내 경과분 : 신규일 당시 계약기간별 정기적금(자유적립식) 실행이율 4/10 약정기간의 80%이내 경과분 : 신규일 당시 계약기간별 정기적금(자유적립식) 실행이율 6/10 약정기간의 100%미만 경과분 : 신규일 당시 계약기간별 정기적금(자유적립식) 실행이율 8/10",
      "만기후금리": "만기후 1개월 이내 경과분 : 만기일 현재 계약기간별 정기적금(자유적립식) 실행이율의 1/2 만기후 1개월 초과 경과분 : 연 0.10%"
    }
  },
  {
    "id": 12,
    "narrative": "은행: BNK경남은행\n제공 금리(%) 1개월 이상 ~ 3개월 미만: 3.0\n3개월 이상 ~ 6개월 미만: 3.0\n6개월 이상 ~ 1년 미만: 3.7\n1년 이상 ~ 1년 6개월 미만: 4.5\n1년 6개월 이상 ~ 만기: 5.0\n은행 확인일: 25/01/20\n우대금리 조건: 주택청약종합저축 보유에 따른 우대이율 : 0.1% - 가입일 현재 예금주 본인명의 경남은행 \"주택청약종합저축(청년우대형 주택청약종합저축 포함)\"을 보유중인 경우\n부가서비스: 해당사항 없음\n중도해지금리: 1일이상 경과분 기본이율×적용율×경과일수/계약일수 (단, 중도해지이율의 최저금리는 0.01%로 한다.) 적용율: 6개월미만 50%, 6~9개월미만 70%, 9~11개월미만 80%, 11개월이상 90%\n만기후금리: 만기후 1개월 이내 : 만기시점 계약기간별 일반정기예금(만기지급식) 기본이율 X 50% 만기후 1개월 초과 : 만기시점 계약기간별 일반정기예금(만기지급식) 기본이율 X 20%",
    "metadata": {
      "은행": "BNK경남은행",
      "제공 금리(%) 1개월 이상 ~ 3개월 미만": "3.0",
      "3개월 이상 ~ 6개월 미만": "3.0",
      "6개월 이상 ~ 1년 미만": "3.7",
      "1년 이상 ~ 1년 6개월 미만": "4.5",
      "1년 6개월 이상 ~ 만기": "5.0",
      "은행 확인일": "25/01/20",
      "우대금리 조건": "주택청약종합저축 보유에 따른 우대이율 : 0.1% - 가입일 현재 예금주 본인명의 경남은행 \"주택청약종합저축(청년우대형 주택청약종합저축 포함)\"을 보유중인 경우",
      "부가서비스": "해당사항 없음",
      "중도해지금리": "1일이상 경과분 기본이율×적용율×경과일수/계약일수 (단, 중도해지이율의 최저금리는 0.01%로 한다.) 적용율: 6개월미만 50%, 6~9개월미만 70%, 9~11개월미만 80%, 11개월이상 90%",
      "만기후금리": "만기후 1개월 이내 : 만기시점 계약기간별 일반정기예금(만기지급식) 기본이율 X 50% 만기후 1개월 초과 : 만기시점 계약기간별 일반정기예금(만기지급식) 기본이율 X 20%"
    }
  },
  {
    "id": 13,
    "narrative": "은행: 우체국\n제공 금리(%) 1개월 이상 ~ 3개월 미만: 3.0\n3개월 이상 ~ 6개월 미만: 3.0\n6개월 이상 ~ 1년 미만: 4.0\n1년 이상 ~ 1년 6개월 미만: 4.5\n1년 6개월 이상 ~ 만기: 5.0\n은행 확인일: 24/10/30\n우대금리 조건: 최고 연 0.8%p 적금자동이체 0.4%p 우체국체크카드 이용 0.2%p 우체국예금 첫 거래 0.2%p (6개월 미만의 경우) 최고 연 0.6%\n부가서비스: 우체국 휴일재해보장보험 서비스\n중도해지금리: 1개월 미만 0.1% 1개월 이상~3개월 미만 기본이율*50%*경과월수/계약월수(최저금리 0.15%) 3개월 이상~6개월 미만 기본이율*60%*경과월수/계약월수(최적금리 0.15%) 6개월 이상~9개월 미만 기본이율*70%*경과월수/계약월수(최저금리 0.20%) 9개월 이상~12개월 미만 기본이율*80%*경과월수/계약월수(최저금리 0.20%) 12개월 이상 기본이율*90%*경과월수/계약월수(최저금리 0.25%)\n만기후금리: 6개월 이내 만기일 당시 해당예금 계약기간별 고시이율의 30% 6개월초과 만기일 당시 보통예금 이율",
    "metadata": {
      "은행": "우체국",
      "제공 금리(%) 1개월 이상 ~ 3개월 미만": "3.0",
      "3개월 이상 ~ 6개월 미만": "3.0",
      "6개월 이상 ~ 1년 미만": "4.0",
      "1년 이상 ~ 1년 6개월 미만": "4.5",
      "1년 6개월 이상 ~ 만기": "5.0",
      "은행 확인일": "24/10/30",
      "우대금리 조건": "최고 연 0.8%p 적금자동이체 0.4%p 우체국체크카드 이용 0.2%p 우체국예금 첫 거래 0.2%p (6개월 미만의 경우) 최고 연 0.6%",
      "부가서비스": "우체국 휴일재해보장보험 서비스",
      "중도해지금리": "1개월 미만 0.1% 1개월 이상~3개월 미만 기본이율*50%*경과월수/계약월수(최저금리 0.15%) 3개월 이상~6개월 미만 기본이율*60%*경과월수/계약월수(최적금리 0.15%) 6개월 이상~9개월 미만 기본이율*70%*경과월수/계약월수(최저금리 0.20%) 9개월 이상~12개월 미만 기본이율*80%*경과월수/계약월수(최저금리 0.20%) 12개월 이상 기본이율*90%*경과월수/계약월수(최저금리 0.25%)",
      "만기후금리": "6개월 이내 만기일 당시 해당예금 계약기간별 고시이율의 30% 6개월초과 만기일 당시 보통예금 이율"
    }
  }
]